{
  "artifact_type": "approval_proof",
  "artifact_version": "0.8",
  "approval_ref": "approval-payment-refund",
  "mode": "secure_widget",
  "approved": true,
  "single_use": true,
  "nonce": "approval-nonce-runtime-example-1",
  "binding": {
    "tool_id": "tool-payment-refund",
    "tool_revision": "tool-rev-1",
    "adapter_id": "adapter-payment-refund",
    "adapter_revision": "adapter-rev-1",
    "arguments_hash": "args-hash-refund-25",
    "context_hash": "context-hash-subject-1-client-1-workspace-1",
    "subject_ref": "subject-1",
    "client_ref": "client-1",
    "workspace_ref": "workspace-1"
  },
  "risk_summary_hash": "risk-summary-r4-refund",
  "cost_summary_hash": "cost-summary-refund-25-eur",
  "issued_at": "2026-07-22T16:00:30Z",
  "expires_at": "2026-07-22T16:05:00Z",
  "integrity": {
    "algorithm": "sha256",
    "digest": "28c906c800f5de765320de706eb298fc17715beadc3808cd82b79623b6870970"
  },
  "signature": {
    "algorithm": "ed25519",
    "key_id": "approval-key-1",
    "value": "Y7ZWeNeqV5lTBOYMtxFaW4ZUAliFfvnwC/AIaDT7syTeOs1nuNrhqaQIpoLKYYpMMP8pwjRbpQOe8/31zYWpAw=="
  }
}
